{
  "schema": "proof-forge.differential.reference.v1",
  "id": "evm-status-message-solidity",
  "targetFamily": "evm",
  "program": "status-message",
  "framework": "Solidity",
  "source": {
    "path": "benchmarks/native/evm/StatusMessage.sol",
    "language": "solidity"
  },
  "provenance": {
    "status": "complete",
    "origin": {
      "name": "ProofForge independent native comparison corpus",
      "url": null
    },
    "revision": "sha256:372b766a7bc64bd31c3d0768d45ad041144bc30e4fd2d48dd648432dfff5fc68",
    "license": "Apache-2.0",
    "toolchain": [
      {"name": "solc", "version": "0.8.30"}
    ],
    "missing": []
  },
  "semanticEligibility": {
    "eligible": true,
    "reasons": []
  }
}
