{
  "schema": "proof-forge.differential.reference.v1",
  "id": "near-ownable-near-sdk-rs",
  "targetFamily": "near",
  "program": "ownable",
  "framework": "near-sdk-rs",
  "source": {
    "path": "testkit/compare/near/ownable/src/lib.rs",
    "language": "rust"
  },
  "provenance": {
    "status": "complete",
    "origin": {
      "name": "ProofForge independent native comparison corpus",
      "url": null
    },
    "revision": "sha256:4f06f64f5c30283c44f15172baa5831630dff1fa067ce94fd4f96bb43cee6df2",
    "license": "Apache-2.0",
    "toolchain": [
      {"name": "near-sdk", "version": "5.28.3"},
      {"name": "rustc", "version": "1.94.0"},
      {"name": "near-vm-runner", "version": "0.37"}
    ],
    "missing": []
  },
  "semanticEligibility": {
    "eligible": true,
    "reasons": []
  }
}
