{
  "schema": "proof-forge.differential.reference.v1",
  "id": "evm-array-example-solidity",
  "targetFamily": "evm",
  "program": "array-example",
  "framework": "Solidity",
  "source": {
    "path": "benchmarks/native/evm/ArrayExample.sol",
    "language": "solidity"
  },
  "provenance": {
    "status": "complete",
    "origin": {
      "name": "ProofForge independent native comparison corpus",
      "url": null
    },
    "revision": "sha256:62977d12ad461aa6f3ab4608c6feff6500038c3d71050efa3b900b97985580f4",
    "license": "Apache-2.0",
    "toolchain": [
      {"name": "solc", "version": "0.8.30"}
    ],
    "missing": []
  },
  "semanticEligibility": {
    "eligible": true,
    "reasons": []
  }
}
