{
  "schema": "proof-forge.differential.reference.v1",
  "id": "evm-counter-solidity",
  "targetFamily": "evm",
  "program": "counter",
  "framework": "Solidity",
  "source": {
    "path": "benchmarks/native/evm/Counter.sol",
    "language": "solidity"
  },
  "provenance": {
    "status": "complete",
    "origin": {
      "name": "ProofForge independent native comparison corpus",
      "url": null
    },
    "revision": "sha256:9537160fb33d5fa97b1c90d68c0eb268c87f2bc534a70120a8a6c8a497a2a3b3",
    "license": "Apache-2.0",
    "toolchain": [
      {"name": "solc", "version": "0.8.30"}
    ],
    "missing": []
  },
  "semanticEligibility": {
    "eligible": true,
    "reasons": []
  }
}
