{
  "schema": "proof-forge.differential.reference.v1",
  "id": "solana-value-vault-pinocchio",
  "targetFamily": "solana",
  "program": "value-vault",
  "framework": "Pinocchio",
  "source": {
    "path": "benchmarks/native/solana/value-vault/src/lib.rs",
    "language": "rust"
  },
  "provenance": {
    "status": "complete",
    "origin": {
      "name": "ProofForge independent native comparison corpus",
      "url": null
    },
    "revision": "sha256:0c9ba77197be8d65627636e173e884516ea11600dde0683656e695925d1a80b8",
    "license": "Apache-2.0",
    "toolchain": [
      {"name": "pinocchio", "version": "0.11.2"},
      {"name": "solana-define-syscall", "version": "5.1.0"},
      {"name": "cargo-build-sbf", "version": "3.1.12"},
      {"name": "platform-tools", "version": "v1.52"}
    ],
    "missing": []
  },
  "semanticEligibility": {
    "eligible": true,
    "reasons": []
  }
}
