{
  "schema": "proof-forge.differential.reference.v1",
  "id": "near-counter-near-sdk-rs",
  "targetFamily": "near",
  "program": "counter",
  "framework": "near-sdk-rs",
  "source": {
    "path": "benchmarks/native/near/counter-rs/src/lib.rs",
    "language": "rust"
  },
  "provenance": {
    "status": "complete",
    "origin": {
      "name": "ProofForge independent native comparison corpus",
      "url": null
    },
    "revision": "sha256:b8b3279fa135b3f902fa62ad10e4524e1d6de792f5a41a3cd014fc70c04b4a41",
    "license": "Apache-2.0",
    "toolchain": [
      {"name": "near-sdk", "version": "5.28.3"},
      {"name": "rustc", "version": "1.94.0"},
      {"name": "near-vm-runner", "version": "0.37"}
    ],
    "missing": []
  },
  "semanticEligibility": {
    "eligible": true,
    "reasons": []
  }
}
